{
  "benchmark_candidates": [
    {
      "benchmark_rank": 1,
      "capture_ratio": 0.00918063314711362,
      "commissions_usd": 0.0,
      "cost_bps_of_position": 120.64934823091245,
      "day_high_timestamp": "2024-04-10T12:25:00-04:00",
      "entry_price": 5.37,
      "entry_slippage_usd": 2.9964600000000003,
      "entry_timestamp": "2024-04-10T09:30:00-04:00",
      "exit_price": 5.40045,
      "exit_reason": "TRAILING_STOP",
      "exit_slippage_usd": 3.0134510999999997,
      "exit_timestamp": "2024-04-10T09:33:00-04:00",
      "fair_simulation_possible": true,
      "gross_realized_pnl_usd": 2.831850000000008,
      "gross_realized_return_pct": 0.567039106145253,
      "maximum_capturable_move_pct": 61.76470588235294,
      "maximum_position_drawdown_pct": -1.3035381750465591,
      "net_capture_ratio": -0.011923159722222194,
      "net_realized_pnl_usd": -3.1934990999999915,
      "net_realized_return_pct": -0.6394543761638717,
      "raw_move_pct": 53.6312849162011,
      "realized_pnl_usd": 2.831850000000008,
      "realized_return_pct": 0.567039106145253,
      "regulatory_fees_usd": 0.015438,
      "scout_exit_reason": null,
      "scout_exit_timestamp": null,
      "scout_net_realized_return_pct": 0.0,
      "scout_realized_return_pct": 0.0,
      "scout_selected": false,
      "scout_selection_basis": "NOT_SELECTED",
      "scout_trade_executed": false,
      "simulation_exclusion_reason": null,
      "ticker": "RENT",
      "total_cost_usd": 6.0253491,
      "trade_executed": true,
      "universe_eligible": true
    },
    {
      "benchmark_rank": 2,
      "capture_ratio": -0.024006849315068395,
      "commissions_usd": 0.0,
      "cost_bps_of_position": 69.76323328785813,
      "day_high_timestamp": "2024-04-10T10:35:00-04:00",
      "entry_price": 14.66,
      "entry_slippage_usd": 1.7445400000000002,
      "entry_timestamp": "2024-04-10T09:30:00-04:00",
      "exit_price": 14.5134,
      "exit_reason": "TRAILING_STOP",
      "exit_slippage_usd": 1.7270946,
      "exit_timestamp": "2024-04-10T09:30:00-04:00",
      "fair_simulation_possible": true,
      "gross_realized_pnl_usd": -4.9843999999999795,
      "gross_realized_return_pct": -0.9999999999999959,
      "maximum_capturable_move_pct": 41.65477888730385,
      "maximum_position_drawdown_pct": -2.1691678035470674,
      "net_capture_ratio": -0.04625976319262428,
      "net_realized_pnl_usd": -8.46167859999998,
      "net_realized_return_pct": -1.6976323328785772,
      "raw_move_pct": 36.69781718963166,
      "realized_pnl_usd": -4.9843999999999795,
      "realized_return_pct": -0.9999999999999959,
      "regulatory_fees_usd": 0.005644,
      "scout_exit_reason": null,
      "scout_exit_timestamp": null,
      "scout_net_realized_return_pct": 0.0,
      "scout_realized_return_pct": 0.0,
      "scout_selected": false,
      "scout_selection_basis": "NOT_SELECTED",
      "scout_trade_executed": false,
      "simulation_exclusion_reason": null,
      "ticker": "TPC",
      "total_cost_usd": 3.4772786000000004,
      "trade_executed": true,
      "universe_eligible": true
    },
    {
      "benchmark_rank": 3,
      "capture_ratio": 0.1875000000000001,
      "commissions_usd": 0.0,
      "cost_bps_of_position": 206.2421652421652,
      "day_high_timestamp": "2024-04-10T11:41:00-04:00",
      "entry_price": 3.51,
      "entry_slippage_usd": 4.9841999999999995,
      "entry_timestamp": "2024-04-10T09:30:00-04:00",
      "exit_price": 3.7125,
      "exit_reason": "TRAILING_STOP",
      "exit_slippage_usd": 5.271749999999999,
      "exit_timestamp": "2024-04-10T09:33:00-04:00",
      "fair_simulation_possible": true,
      "gross_realized_pnl_usd": 28.755000000000017,
      "gross_realized_return_pct": 5.769230769230773,
      "maximum_capturable_move_pct": 30.76923076923077,
      "maximum_position_drawdown_pct": 0.0,
      "net_capture_ratio": 0.12047129629629641,
      "net_realized_pnl_usd": 18.475478000000017,
      "net_realized_return_pct": 3.7068091168091204,
      "raw_move_pct": 30.76923076923077,
      "realized_pnl_usd": 28.755000000000017,
      "realized_return_pct": 5.769230769230773,
      "regulatory_fees_usd": 0.023572,
      "scout_exit_reason": null,
      "scout_exit_timestamp": null,
      "scout_net_realized_return_pct": 0.0,
      "scout_realized_return_pct": 0.0,
      "scout_selected": false,
      "scout_selection_basis": "NOT_SELECTED",
      "scout_trade_executed": false,
      "simulation_exclusion_reason": null,
      "ticker": "ETAO",
      "total_cost_usd": 10.279521999999998,
      "trade_executed": true,
      "universe_eligible": true
    },
    {
      "benchmark_rank": 4,
      "capture_ratio": -0.02778616184683398,
      "commissions_usd": 0.0,
      "cost_bps_of_position": 39.889274214832405,
      "day_high_timestamp": "2024-04-10T15:39:00-04:00",
      "entry_price": 37.89,
      "entry_slippage_usd": 0.98514,
      "entry_timestamp": "2024-04-10T09:30:00-04:00",
      "exit_price": 37.597229999999996,
      "exit_reason": "TRAILING_STOP",
      "exit_slippage_usd": 0.9775279799999999,
      "exit_timestamp": "2024-04-10T09:31:00-04:00",
      "fair_simulation_possible": true,
      "gross_realized_pnl_usd": -3.8060100000000574,
      "gross_realized_return_pct": -0.7726840855107004,
      "maximum_capturable_move_pct": 27.80823381688975,
      "maximum_position_drawdown_pct": -1.0029031406703637,
      "net_capture_ratio": -0.04461456497050267,
      "net_realized_pnl_usd": -5.770835980000057,
      "net_realized_return_pct": -1.1715768276590246,
      "raw_move_pct": 26.259963050936918,
      "realized_pnl_usd": -3.8060100000000574,
      "realized_return_pct": -0.7726840855107004,
      "regulatory_fees_usd": 0.0021579999999999998,
      "scout_exit_reason": null,
      "scout_exit_timestamp": null,
      "scout_net_realized_return_pct": 0.0,
      "scout_realized_return_pct": 0.0,
      "scout_selected": false,
      "scout_selection_basis": "NOT_SELECTED",
      "scout_trade_executed": false,
      "simulation_exclusion_reason": null,
      "ticker": "ALPN",
      "total_cost_usd": 1.9648259799999999,
      "trade_executed": true,
      "universe_eligible": true
    },
    {
      "benchmark_rank": 5,
      "capture_ratio": -0.034872205789430365,
      "commissions_usd": 0.0,
      "cost_bps_of_position": 39.842564102564104,
      "day_high_timestamp": "2024-04-10T13:53:00-04:00",
      "entry_price": 39.0,
      "entry_slippage_usd": 0.936,
      "entry_timestamp": "2024-04-10T09:30:00-04:00",
      "exit_price": 38.61,
      "exit_reason": "TRAILING_STOP",
      "exit_slippage_usd": 0.9266399999999999,
      "exit_timestamp": "2024-04-10T09:30:00-04:00",
      "fair_simulation_possible": true,
      "gross_realized_pnl_usd": -4.680000000000007,
      "gross_realized_return_pct": -1.0000000000000013,
      "maximum_capturable_move_pct": 28.676132678223,
      "maximum_position_drawdown_pct": -1.7948717948717996,
      "net_capture_ratio": -0.054538600000000055,
      "net_realized_pnl_usd": -6.544632000000007,
      "net_realized_return_pct": -1.3984256410256424,
      "raw_move_pct": 25.64102564102564,
      "realized_pnl_usd": -4.680000000000007,
      "realized_return_pct": -1.0000000000000013,
      "regulatory_fees_usd": 0.001992,
      "scout_exit_reason": null,
      "scout_exit_timestamp": null,
      "scout_net_realized_return_pct": 0.0,
      "scout_realized_return_pct": 0.0,
      "scout_selected": false,
      "scout_selection_basis": "NOT_SELECTED",
      "scout_trade_executed": false,
      "simulation_exclusion_reason": null,
      "ticker": "JANX",
      "total_cost_usd": 1.864632,
      "trade_executed": true,
      "universe_eligible": true
    },
    {
      "benchmark_rank": 6,
      "capture_ratio": null,
      "commissions_usd": null,
      "cost_bps_of_position": null,
      "day_high_timestamp": "2024-04-10T14:40:00-04:00",
      "entry_price": null,
      "entry_slippage_usd": null,
      "entry_timestamp": null,
      "exit_price": null,
      "exit_reason": null,
      "exit_slippage_usd": null,
      "exit_timestamp": null,
      "fair_simulation_possible": false,
      "gross_realized_pnl_usd": null,
      "gross_realized_return_pct": null,
      "maximum_capturable_move_pct": 24.925595238095234,
      "maximum_position_drawdown_pct": null,
      "net_capture_ratio": null,
      "net_realized_pnl_usd": null,
      "net_realized_return_pct": null,
      "raw_move_pct": 24.925595238095234,
      "realized_pnl_usd": null,
      "realized_return_pct": null,
      "regulatory_fees_usd": null,
      "scout_exit_reason": null,
      "scout_exit_timestamp": null,
      "scout_net_realized_return_pct": 0.0,
      "scout_realized_return_pct": 0.0,
      "scout_selected": false,
      "scout_selection_basis": "NOT_SELECTED",
      "scout_trade_executed": false,
      "simulation_exclusion_reason": "MAX_POSITIONS_REACHED",
      "ticker": "RNAC",
      "total_cost_usd": null,
      "trade_executed": null,
      "universe_eligible": true
    },
    {
      "benchmark_rank": 7,
      "capture_ratio": null,
      "commissions_usd": null,
      "cost_bps_of_position": null,
      "day_high_timestamp": "2024-04-10T13:01:00-04:00",
      "entry_price": null,
      "entry_slippage_usd": null,
      "entry_timestamp": null,
      "exit_price": null,
      "exit_reason": null,
      "exit_slippage_usd": null,
      "exit_timestamp": null,
      "fair_simulation_possible": false,
      "gross_realized_pnl_usd": null,
      "gross_realized_return_pct": null,
      "maximum_capturable_move_pct": 27.5289956831539,
      "maximum_position_drawdown_pct": null,
      "net_capture_ratio": null,
      "net_realized_pnl_usd": null,
      "net_realized_return_pct": null,
      "raw_move_pct": 24.467005076142144,
      "realized_pnl_usd": null,
      "realized_return_pct": null,
      "regulatory_fees_usd": null,
      "scout_exit_reason": null,
      "scout_exit_timestamp": null,